{
  "colors": {
    "primary": "#512BD4",
    "white": "#FFFFFF",
    "black": "#000000",
    "background": {
      "card": "#F3F3F3",
      "layer": "#F9F9F9"
    },
    "text": {
      "primary": "#000000",
      "secondary": "#6B6B6B"
    }
  },
  "spacing": {
    "xs": 4,
    "sm": 8,
    "md": 16,
    "lg": 24,
    "buttonPadding": {
      "horizontal": 14,
      "vertical": 10
    }
  },
  "typography": {
    "fontSize": {
      "base": 14,
      "caption": 12
    },
    "fontWeight": {
      "normal": 400,
      "semibold": 600
    }
  },
  "borders": {
    "radius": {
      "sm": 4,
      "md": 8
    },
    "width": {
      "thin": 1,
      "thick": 3
    }
  },
  "sizes": {
    "thumbnail": {
      "width": 150,
      "height": 190
    },
    "thumbnailContainer": {
      "width": 150,
      "height": 220
    }
  }
}
